201505130008,2015,5,13,,0,,153,Pakistan,6,South Asia,Sindh,Karachi,24.93778,67.15187,1,0,The incident occurred in Safoora Goth neighborhood,"""05/13/2015: Six assailants armed with machine guns and pistols opened fire on a bus carrying members of the Shiite Ismaili community in Safoora Goth area, Karachi city, Sindh province, Pakistan. At least 45 people were killed and 13 others were injured in the assault. The Khorasan Chapter of the Islamic State claimed responsibility for the incident and stated that the attack was carried out in retaliation for the killing of people in both Syria and Iraq. Additionally, Jundallah and Tehrik-i-Taliban Pakistan (TTP) claimed responsibility for the incident.""",1,1,1,0,,.,0,1,0,2,Armed Assault,,.,,.,14,Private Citizens & Property,69,Religion Identified,Not Applicable,Bus of Ismaili Shiite Civilians,153,Pakistan,,.,,.,,,,.,,.,,.,,,,.,Khorasan Chapter of the Islamic State,,Jundallah,,Tehrik-i-Taliban Pakistan (TTP),40371,20251,20442,,"""The Khorasan Chapter of the Islamic State claimed responsibility for the incident and stated that the attack was carried out in retaliation for the killing of people in both Syria and Iraq. Sources also suspected that the attack, which targeted Shiite civilians, may have been part of a larger trend of sectarian violence between Pakistan's majority Sunni and minority Shiite communities.""",0,0,0,6,0,1,5,Note left at scene,1,2,Call (post-incident),1,10,Unknown,1,5,Firearms,2,Automatic Weapon,5,Firearms,3,Handgun,,.,,.,,.,,.,AK-47 assault rifles and 9-mm pistols were used in the attack.,45,0,0,13,0,0,1,3,Minor (likely < $1 million),-99,A passenger bus was damaged in this attack.,0,,,,,,,,,,,,,,.,,"""Casualty numbers for this incident conflict across sources. Following GTD protocol, the majority reliable estimates are reported here.""","""""""Karachi at standstill after Shiite massacre claimed by IS,"""" Agence France Presse -- English, May 14, 2015.""","""""""IS Claims Deadly Attack On Karachi Shiites, First In Pakistan,"""" AFP (World Service), May 13, 2015.""","""""""42 killed in Pakistan bus attack,"""" CNN, May 13, 2015.""",START Primary Collection,0,1,0,1,
201505140082,2015,5,14,,0,,205,Thailand,5,Southeast Asia,Yala,Yala,6.541102,101.280407,1,0,,"""05/14/2015: An explosive device detonated at a train station in Yala city, Yala province, Thailand. This was one of 23 related bombings in Muang on this date and a string of bombings over three days in which 36 explosive devices were detonated throughout the district. At least 20 people were injured across the bombings on Thursday, May 14, 2015. No group claimed responsibility for the incidents; however, security officials attributed the attacks to Runda Kumpulan Kecil (RKK).""",1,1,1,0,,.,1,1,0,3,Bombing/Explosion,,.,,.,19,Transportation,100,Train/Train Tracks/Trolley,State Railway of Thailand,Railway Station,205,Thailand,,.,,.,,,,.,,.,,.,,,,.,Runda Kumpulan Kecil (RKK),,,,,30064,,,,,0,,,-99,0,0,,.,,,.,,,.,,6,Explosives/Bombs/Dynamite,16,Unknown Explosive Type,,.,,.,,.,,.,,.,,.,,0,0,0,0,0,0,-9,,.,,It is unknown if any property was damaged in this attack.,0,,,,,,,,,,,,,,.,,"""Casualty numbers for this incident conflict across sources. Following GTD protocol, the majority reliable estimates are reported here. Casualty numbers for this attack represent a division of the cumulative total of those wounded across incidents 201505140082 201505140083, 201505140084, 201505140085, 201505140086, 201505140087, 201505140088, 201505140089, 201505140090, 201505140091, 201505140092, 201505140093, 201505140094, 201505140095, 201505140096, 201505140097, 201505140098, 201505140099, 201505140100, 201505140101, 201505140102, 201505140103, 201505140104.""","""""""Army chief: 36 Yala bombs 'political',"""" Bangkok Post, May 17, 2015.""","""""""Three more bombs hit Yala,"""" Bangkok Post, May 16, 2015.""","""""""Thailand: More bomb explosions rock Yala town,"""" Thai PBS Online, May 16, 2015.""",START Primary Collection,0,0,0,0,"""201505140083, 201505140084, 201505140085, 201505140086, 201505140087, 201505140088, 201505140089, 201505140090, 201505140091, 201505140092, 201505140093, 201505140094, 201505140095, 201505140096, 201505140097, 201505140098, 201505140099, 201505140100, 201505140101, 201505140102, 201505140103, 201505140104"""
201505170080,2015,5,17,,1,5/18/2015,200,Syria,10,Middle East & North Africa,Homs,Hulayhilah,34.707778,38.790235,1,1,The incident occurred at the Al-Hail gas field near the city,"""05/17/2015: Assailants attacked Al-Hail gas field near Hulayhilah, Homs governorate, Syria. This was one of two gas fields overtaken by the same assailants on this date. At least 56 security forces were killed across the two clashes, which lasted until May 18, 2015. The Islamic State of Iraq and the Levant (ISIL) claimed responsibility for the attacks.""",1,1,1,0,,.,1,1,0,9,Unknown,,.,,.,1,Business,1,Gas/Oil,Unknown,Al-Hail Gas Field,200,Syria,,.,,.,,,,.,,.,,.,,,,.,Islamic State of Iraq and the Levant (ISIL),,,,,40151,,,,,0,,,-99,0,1,8,Personal claim,,,.,,,.,,13,Unknown,,.,,.,,.,,.,,.,,.,,.,,28,0,0,0,0,0,0,,.,,,0,,,,,,,,,,,,,,.,,Casualty numbers for this attack represent a division of the cumulative total of those killed across incidents 201505170080 and 201505170081.,"""""""IS takes gas fields after Palmyra civilian deaths: monitor,"""" Agence France Presse -- English, May 18, 2015.""","""""""IS takes gas fields after Palmyra civilian deaths,"""" Big News Network, May 18, 2015.""","""""""Terrorism: Transcript of ISIL's Al-Bayan Radio Broadcast for 18 May,"""" Twitter, May 18, 2015.""",START Primary Collection,-9,-9,0,-9,201505170081
201505200007,2015,5,20,,0,,155,West Bank and Gaza Strip,10,Middle East & North Africa,West Bank,Jerusalem,31.779547,35.246521,1,0,The incident occurred in Altur neighborhood,"""05/20/2015: An assailant targeted Border Police officers with a vehicle in A-Tur neighborhood, Jerusalem city, West Bank, West Bank and Gaza Strip. The assailant was killed and at least two officers were injured in the attack. No group claimed responsibility for the incident; however, a police official identified the assailant as Amran Abu Dhein and stated that he was affiliated with Hamas (Islamic Resistance Movement).""",1,1,1,0,,.,0,1,0,8,Unarmed Assault,,.,,.,3,Police,25,Police Security Forces/Officers,Israeli Border Police,Officers,97,Israel,,.,,.,,,,.,,.,,.,,,,.,Hamas (Islamic Resistance Movement),,,,,399,,,,,0,,,1,0,0,,.,,,.,,,.,,10,"""Vehicle (not to include vehicle-borne explosives, i.e., car or truck bombs)""",,.,,.,,.,,.,,.,,.,,.,,1,0,1,2,0,0,0,,.,,,0,,,,,,,,,,,,,,.,,"""Casualty numbers for this incident conflict across sources. Following GTD protocol, the lowest reliable estimates are reported here.""","""""""Palestinian driver rams 2 police, shot dead: Israel,"""" Agence France Presse -- English, May 20, 2015.""","""""""Terrorist shot dead after running down 2 Border Police officers in east Jerusalem,"""" Jerusalem Post, May 20, 2015.""","""""""Soldier recalls death of Jerusalem attacker,"""" Ynet News, May 20, 2015.""",START Primary Collection,0,0,0,0,
201505230005,2015,5,23,,0,,182,Somalia,11,Sub-Saharan Africa,Banaadir,Mogadishu,2.03334,45.32013,1,0,The incident occurred along Makkah-Al Mukkarramah avenue,"""05/23/2015: Assailants opened fire on a vehicle carrying two members of parliament on Makkah-Al Mukkarramah avenue, Mogadishu city, Banaadir region, Somalia. One member and the driver were killed and the other member was injured in the attack. Al-Shabaab claimed responsibility for the incident.""",1,1,1,1,5,State Actors,0,1,0,1,Assassination,,.,,.,2,Government (General),15,Politician or Political Party Movement/Meeting/Rally,Parliament of the Republic of Somalia,"""Members: Yusuf Dirir, Ali Muhummed""",182,Somalia,,.,,.,,,,.,,.,,.,,,,.,Al-Shabaab,,,,,20036,,,,,0,,,-99,0,1,8,Personal claim,,,.,,,.,,5,Firearms,2,Automatic Weapon,,.,,.,,.,,.,,.,,.,,2,0,0,1,0,0,1,3,Minor (likely < $1 million),-99,A vehicle was damaged in this attack.,0,,,,,,,,,,,,,,.,,"""There is doubt that this incident meets terrorism-related criteria, given that a source attributed the attack to government forces. Casualty numbers for this incident conflict across sources. Following GTD protocol, the majority reliable estimates are reported here.""","""""""Somalia:   Militants   kill lawmaker in capital,   attack   2 towns,"""" The Associated Press, May 23, 2015.""","""""""Somali Soldiers Killed MP Yusuf, Says Security Ministry,"""" Shabelle Media Network (Mogadishu), May 24, 2015.""","""""""Somali lawmaker   shot   dead by mistake: gov't,"""" Xinhua General News Service, May 24, 2015.""",START Primary Collection,0,0,0,0,
201505240003,2015,5,24,,0,,153,Pakistan,6,South Asia,Balochistan,Hub,25.026813,66.884313,1,0,,"""05/24/2015: An explosives-laden vehicle detonated near the convoy of Salman Mamnoon, the son of President Mamnoon Hussain, in Hub city, Balochistan province, Pakistan. Mamnoon was unharmed in the attack; however, three people were killed and at least 15 others were injured in the blast. The Baloch Liberation Army (BLA) claimed responsibility for the incident and stated that the attack was carried out in retaliation to a recent military operation in the area.""",1,1,1,0,,.,0,0,0,1,Assassination,,.,,.,2,Government (General),17,Head of State,Government of Pakistan,Convoy of Son of President: Salman Mamnoon,153,Pakistan,14,Private Citizens & Property,67,Unnamed Civilian/Unspecified,Not Applicable,Civilians,153,Pakistan,,.,,.,,,,.,Baloch Liberation Army (BLA),,,,,20095,,,,The Baloch Liberation Army (BLA) claimed responsibility for the incident and stated that the attack was carried out in retaliation for a recent military operation in the area.,0,,,4,4,1,2,Call (post-incident),,,.,,,.,,6,Explosives/Bombs/Dynamite,15,Vehicle,,.,,.,,.,,.,,.,,.,A remote-controlled explosives-laden motorcycle was used in the attack.,3,0,0,15,0,0,1,3,Minor (likely < $1 million),-99,An unknown number of vehicles in a convoy were damaged in this attack.,0,,,,,,,,,,,,,,.,,,"""""""Son of Pakistan's president escapes   bomb attack   killing 3,"""" The Associated Press, May 25, 2015.""","""""""Four 'BLA militants' involved in attack on president's son arrested,"""" The Express Tribune, May 26, 2015.""","""""""4 suspects held in attack targeting Pak President's son,"""" Chandigarh Tribune, May 26, 2015.""",START Primary Collection,0,0,0,0,
201505260025,2015,5,26,2015-05-26 00:00:00,0,,228,Yemen,10,Middle East & North Africa,Taizz,Taizz,13.578889,44.021944,1,0,,"""05/26/2015: Assailants fired projectiles at a passenger bus in Taizz city, Taizz governorate, Yemen. Five civilians were killed and thirty-five others were wounded in the attack. No group claimed responsibility for the incident; however, sources attributed the attack to Huthis.""",1,1,1,0,,.,0,1,0,3,Bombing/Explosion,,.,,.,19,Transportation,99,Bus (excluding tourists),Unknown,Bus,228,Yemen,,.,,.,,,,.,,.,,.,,,,.,Huthi Extremists,,,,,20198,,,,,0,,,-99,0,0,,.,,,.,,,.,,6,Explosives/Bombs/Dynamite,11,"""Projectile (rockets, mortars, RPGs, etc.)""",,.,,.,,.,,.,,.,,.,,5,0,0,35,0,0,1,3,Minor (likely < $1 million),-99,A passenger bus was damaged in this attack.,0,,,,,,,,,,,,,,.,,,"""""""Yemen: Unrest Update 27 May 2015,"""" OSC Summary, May 26, 2015.""",,,START Primary Collection,0,0,0,0,
201505270088,2015,5,27,,0,,228,Yemen,10,Middle East & North Africa,Adan,Aden,12.8,45.033333,1,1,,"""05/27/2015: Assailants set up a roadblock and prevented transit into Aden city, Adan governorate, Yemen. No casualties were reported. No group claimed responsibility for the incident; however, sources attributed the attack to Huthis.""",1,1,1,0,,.,0,0,0,9,Unknown,,.,,.,1,Business,7,Retail/Grocery/Bakery,Unknown,Trucks,228,Yemen,,.,,.,,,,.,,.,,.,,,,.,Huthi Extremists,,,,,20198,,,,,0,,,-99,0,0,,.,,,.,,,.,,13,Unknown,,.,,.,,.,,.,,.,,.,,.,,0,0,0,0,0,0,0,,.,,,0,,,,,,,,,,,,,,.,,,"""""""No mily solution to Yemeni conflict: UN,"""" The Nation Pakistan, May 29, 2015.""",,,START Primary Collection,0,0,0,0,
201505290002,2015,5,29,,1,,153,Pakistan,6,South Asia,Balochistan,Mastung district,29.798417,66.84691,3,0,,"""05/29/2015: Assailants hijacked two buses travelling to Karachi and abducted 30 passengers in Mastung district, Balochistan province, Pakistan. Five of the hostages were rescued by security forces and 22 others were found dead later that day. The fate of the remaining three hostages is unknown. The United Baloch Army (UBA) claimed responsibility for the incident and stated that the attack was carried out in retaliation to military operations in the area.""",1,1,1,0,,.,0,1,0,4,Hijacking,,.,,.,19,Transportation,99,Bus (excluding tourists),Unknown,Buses,153,Pakistan,,.,,.,,,,.,,.,,.,,,,.,United Baloch Army (UBA),,,,,10101,,,,The United Baloch Army (UBA) claimed responsibility for the incident and stated that the attack was carried out in retaliation for military operations in the area.,0,,,15,0,1,8,Personal claim,,,.,,,.,,5,Firearms,2,Automatic Weapon,5,Firearms,5,Unknown Gun Type,,.,,.,,.,,.,Automatic rifles and other firearms were used in the attack.,22,0,0,3,0,0,1,3,Minor (likely < $1 million),-99,Two buses were damaged in this attack.,1,30,0,,-99,,,0,,,,,,6,Combination,5,"""Casualty numbers for this incident conflict across sources. Following GTD protocol, the most recent reliable estimates are reported here. Five of the hostage victims were released shortly after the abduction. Twenty-two hostages were killed the same day. The fate of the remaining victims is unknown.""","""""""At Least 21 Killed In Pakistan As Gunmen Storm Buses: Officials,"""" AFP (World Service), May 30, 2015.""","""""""Pakistan: Curbing violence: Karachi-style operation planned for Balochistan,"""" The Express Tribune Online, May 31, 2015.""","""""""Gunmen kill 22 passengers in Pak,"""" The Gulf Today, May 30, 2015.""",START Primary Collection,0,0,0,0,
201506010093,2015,6,1,,0,,45,Colombia,3,South America,Norte de Santander,Las Mercedes,8.29985,-72.88991,1,0,,"""06/01/2015: Assailants attacked a police station in Las Mercedes corregimiento, Cucuta municipality, Norte de Santander department, Colombia. One officer was killed and another was wounded in the attack. No group claimed responsibility; however, sources attributed the incident to the Revolutionary Armed Forces of Colombia (FARC).""",1,1,1,0,,.,0,1,0,9,Unknown,,.,,.,3,Police,22,"""Police Building (headquarters, station, school)""",National Police of Colombia,Police Station,45,Colombia,,.,,.,,,,.,,.,,.,,,,.,Revolutionary Armed Forces of Colombia (FARC),,,,,576,,,,,0,,,-99,0,0,,.,,,.,,,.,,13,Unknown,,.,,.,,.,,.,,.,,.,,.,,1,0,0,1,0,0,0,,.,,,0,,,,,,,,,,,,,,.,,,"""""""Colombia Guerrilla Update: FARC Murder Policeman in Miranda (Cauca),"""" OSC Summary, June 5, 2015.""",,,START Primary Collection,0,0,0,0,
201506050045,2015,6,5,,1,,195,Sudan,11,Sub-Saharan Africa,Unknown,Unknown,,,5,0,The incident occurred in Eastern Sudan,"""06/05/2015: Assailants attacked a United Nations High Commissioner for Refugees (UNHCR) vehicle convoy in eastern Sudan. Six civilians and a convoy driver were wounded and fourteen Eritrean refugees were abducted in the attack. The assailants demanded a ransom of $5,000 for at least one of the refugees, but the result of the kidnapping was unknown. No group claimed responsibility; however, sources attributed the incident to armed tribesmen.""",1,1,1,0,,.,0,1,0,6,Hostage Taking (Kidnapping),2,Armed Assault,,.,13,Other,65,Refugee Camp,Not Applicable,Refugees,63,Eritrea,,.,,.,,,,.,,.,,.,,,,.,Tribesmen,,,,,40079,,,,,0,,,-99,0,0,,.,,,.,,,.,,5,Firearms,5,Unknown Gun Type,,.,,.,,.,,.,,.,,.,,,0,0,7,0,0,0,,.,,,1,14,0,,-99,,,1,5000,0,-99,0,"""The assailants demanded a ransom of $5,000 for the release of one of the fourteen hostage victims.""",7,Unknown,-99,"""Casualty numbers for this incident conflict across sources. Following GTD protocol, the majority reliable estimates are reported here.""","""""""UN: 14 Eritrean asylum seekers abducted in eastern Sudan,"""" The Associated Press, June 5, 2015.""","""""""Gunmen   kidnap Eritrean asylum seekers in Sudan: UN,"""" Agence France Presse -- English, June 4, 2015.""","""""""Sudan: Rashaida kidnappers demand $5,000 ransom and threaten death for Eritrean captives,"""" International Business Times UK, June 8, 2015.""",START Primary Collection,-9,-9,1,1,
201506060009,2015,6,6,2015-06-06 00:00:00,0,,45,Colombia,3,South America,Antioquia,San Andres de Cuerquia district,6.913245,-75.67556,3,0,The incident occurred in La Ese,"""06/06/2015: Assailants set fire to a SERTRANS Transportation Company bus in La Ese area, San Andres de Cuerquia municipality, Antioquia department, Colombia. There were no reported casualties in the attack, but the bus was destroyed by the blaze. No group claimed responsibility; however, sources attributed the incident to the Revolutionary Armed Forces of Colombia (FARC).""",1,1,1,0,,.,0,1,0,7,Facility/Infrastructure Attack,,.,,.,19,Transportation,99,Bus (excluding tourists),SERTRANS Transportation Company,Bus,45,Colombia,,.,,.,,,,.,,.,,.,,,,.,Revolutionary Armed Forces of Colombia (FARC),,,,,576,,,,,0,,,4,0,0,,.,,,.,,,.,,8,Incendiary,18,Arson/Fire,,.,,.,,.,,.,,.,,.,,0,0,0,0,0,0,1,3,Minor (likely < $1 million),-99,A bus was damaged in this attack.,0,,,,,,,,,,,,,,.,,,"""""""Colombia Guerrilla Update: FARC Attacks in Antioquia, Cauca, Huila, Norte de Santander,"""" OSC Summary, June 8, 2015.""",,,START Primary Collection,0,0,0,0,
201506150147,2015,6,15,,0,,60,Egypt,10,Middle East & North Africa,Giza,Barajil,30.076843,31.158298,1,0,,"""06/15/2015: Explosive devices detonated at the base of a transmission tower in Barajil village, Giza governorate, Egypt. This is one of four related attacks on transmission towers in Barajil on this date. No casualties were reported. No group claimed responsibility for the attack.""",1,1,1,0,,.,1,1,0,3,Bombing/Explosion,,.,,.,21,Utilities,107,Electricity,Unknown,Electricity Transmission Tower,60,Egypt,,.,,.,,,,.,,.,,.,,,,.,Unknown,,,,,-9,,,,,0,,,-99,0,0,,.,,,.,,,.,,6,Explosives/Bombs/Dynamite,29,Sticky Bomb,,.,,.,,.,,.,,.,,.,,0,0,0,0,0,0,1,4,Unknown,-99,A transmission tower was damaged in this attack.,0,,,,,,,,,,,,,,.,,,"""""""3 Giza Transmission Towers Collapse In Twin Bomb Attacks,"""" The Cairo Post, June 15, 2015.""","""""""32 IEDs destroy 4 electricity transmission towers in Giza,"""" Egypt Independent, June 15, 2015.""","""""""State PAO: Cairo Media Report 16 June 2015,"""" OSC Summary, June 16, 2015.""",START Primary Collection,-9,-9,0,-9,"""201506160039, 201506150147, 201506150148"""
201506160052,2015,6,16,,0,,200,Syria,10,Middle East & North Africa,Aleppo,Aleppo,36.211683,37.1473,1,0,The incident occurred on Al-Nile street.,"""06/16/2015: Assailants fired rockets that landed and detonated on Nile Street in Aleppo city, Aleppo governorate, Syria. This was one of five projectile attacks in different Aleppo neighborhoods on the same day. At least seven people were killed and an unknown number of others were injured across the five incidents. No group claimed responsibility; however, sources attributed the attacks to Muslim fundamentalists.""",1,1,1,0,,.,1,1,0,3,Bombing/Explosion,,.,,.,19,Transportation,104,Highway/Road/Toll/Traffic Signal,Nile Street,Street,200,Syria,,.,,.,,,,.,,.,,.,,,,.,Muslim Fundamentalists,,,,,484,,,,,0,,,-99,0,0,,.,,,.,,,.,,6,Explosives/Bombs/Dynamite,11,"""Projectile (rockets, mortars, RPGs, etc.)""",,.,,.,,.,,.,,.,,.,Rockets were used in the attack.,1,0,0,,0,0,-9,,.,,It is unknown if any property was damaged in this attack.,0,,,,,,,,,,,,,,.,,Casualty numbers for this attack represent a division of the cumulative total of those killed across incidents (201506160049-53).,"""""""Rebel rocket   fire kills 7 in Syria's Aleppo: monitor,"""" Agence France Presse -- English, June 17, 2015.""","""""""Rebel rocket fire kills 7 in Syrias Aleppo monitor,"""" Big News Network, June 17, 2015.""","""""""SOHR: More civilians killed in shelling the city of Aleppo,"""" Syrian Observatory for Human Rights, June 17, 2015.""",START Primary Collection,-9,-9,0,-9,"""201506160049, 201506160050, 201506160051, 201506160053"""
201506220026,2015,6,22,,1,9/10/2015,4,Afghanistan,6,South Asia,Kabul,Kabul,34.552087,69.15615,1,0,The incident occurred in the Taimani area of the city.,"""06/22/2015: Assailants abducted Anja de Beer, the country director for an international NGO, in Taimani area, Kabul city, Kabul province, Afghanistan. De Beer was released unharmed on September 10, 2015. No group claimed responsibility for the incident.""",1,1,1,0,,.,0,1,0,6,Hostage Taking (Kidnapping),,.,,.,12,NGO,62,International NGO,Helvetas,Dutch Country Director: Anja de Beer,422,International,,.,,.,,,,.,,.,,.,,,,.,Unknown,,,,,-9,,,,,0,,,-99,0,0,,.,,,.,,,.,,5,Firearms,5,Unknown Gun Type,,.,,.,,.,,.,,.,,.,,0,0,0,0,0,0,0,,.,,,1,1,0,,80,,,0,,,,,,2,Hostage(s) released by perpetrators,1,,"""""""Afghanistan: Gunmen Kidnap Foreign Aid Worker in Kabul,"""" TOLOnews Online, June 23, 2015.""","""""""Afghanistan: Unknown Gunmen Kidnap Dutch Woman in Kabul City,"""" Pajhwok Afghan News, June 22, 2015.""","""""""Program Summary: Kandahar Radio Killid Pashto 1430 GMT 10 September 2015,"""" Kandahar Radio Killid, September 10, 2015.""",START Primary Collection,-9,-9,1,1,
201506220033,2015,6,22,,0,,60,Egypt,10,Middle East & North Africa,North Sinai,Arish,31.132093,33.803276,1,0,,"""06/22/2015: An explosive detonated inside a house used by police personnel in Arish city, North Sinai governorate, Egypt. This was one of two related attacks targeting police residences in Arish on this date. At least eight people, including police officers and civilians, were injured across both attacks. The Sinai Province of the Islamic State claimed responsibility for the incidents.""",1,1,1,0,,.,1,1,0,3,Bombing/Explosion,,.,,.,3,Police,25,Police Security Forces/Officers,Egyptian National Police (ENP),House of Officer,60,Egypt,,.,,.,,,,.,,.,,.,,,,.,Sinai Province of the Islamic State,,,,,40394,,,,,0,,,-99,0,1,7,"""Posted to website, blog, etc.""",,,.,,,.,,6,Explosives/Bombs/Dynamite,16,Unknown Explosive Type,,.,,.,,.,,.,,.,,.,,0,0,0,4,0,0,1,3,Minor (likely < $1 million),-99,A house was damaged in this attack.,0,,,,,,,,,,,,,,.,,Casualty numbers for this incident represent a division of a cumulative total of wounded across incidents 201506220031 and 201506220033.,"""""""Security sources: Blasts in Egypt's North Sinai wound police, civilians,"""" Al-Masry Al-Youm Online, June 23, 2015.""","""""""Blasts in Egypt's North Sinai,"""" Zawya.com, June 22, 2015.""","""""""Eight injured in bomb blast in Egypt's Sinai,"""" World Bulletin, June 22, 2015.""",START Primary Collection,0,0,0,0,201506220031
201506240010,2015,6,24,,0,,182,Somalia,11,Sub-Saharan Africa,Banaadir,Mogadishu,2.041429,45.310382,1,0,The incident occurred in the Hodan neighborhood of the city.,"""06/24/2015: A suicide bomber detonated an explosives-laden vehicle near a United Arab Emirates Ministry of Foreign Affairs diplomatic convoy in Hodan neighborhood, Mogadishu city, Banaadir region, Somalia. In addition to the bomber, 14 people were killed and four others were injured in the blast. Al-Shabaab claimed responsibility for the incident.""",1,1,1,0,,.,0,0,1,1,Assassination,,.,,.,7,Government (Diplomatic),45,"""Diplomatic Personnel (outside of embassy, consulate)""",United Arab Emirates Ministry of Foreign Affairs,Diplomatic Convoy,215,United Arab Emirates,14,Private Citizens & Property,67,Unnamed Civilian/Unspecified,Not Applicable,Civilians,182,Somalia,,.,,.,,,,.,Al-Shabaab,,,,,20036,,,,,0,,,1,0,1,8,Personal claim,,,.,,,.,,6,Explosives/Bombs/Dynamite,15,Vehicle,,.,,.,,.,,.,,.,,.,,15,0,1,4,0,0,-9,,.,,It is unknown if any property was damaged in this attack.,0,,,,,,,,,,,,,,.,,"""Casualty numbers for this incident conflict across sources. Following GTD protocol, the majority reliable estimates are reported here.""","""""""Car bomb targeting UAE officials kills three Somali soldiers in Mogadishu,"""" Reuters, June 24, 2015.""","""""""Xinhua: Security Council Condemns Attack On Diplomats In Somalia,"""" Xinhua, June 25, 2015.""","""""""At Least 12 Killed in Attack Targeting U.A.E. Ambassador to Somalia,"""" Latin American Herald Tribune, June 25, 2015.""",START Primary Collection,0,1,1,1,
201507030110,2015,7,3,,0,,123,Mali,11,Sub-Saharan Africa,Gao,Tacharan,16.175741,0.065054,1,0,,"""07/03/2015: Assailants killed an ambulance driver in Tacharan village, Gao region, Mali. No group claimed responsibility; however, sources attributed the incident to Movement for Oneness and Jihad in West Africa (MUJAO).""",1,1,1,0,,.,0,1,0,9,Unknown,,.,,.,13,Other,63,Ambulance,Unknown,Ambulance Driver,123,Mali,,.,,.,,,,.,,.,,.,,,,.,Movement for Oneness and Jihad in West Africa (MUJAO),,,,,40021,,,,,0,,,-99,0,0,,.,,,.,,,.,,13,Unknown,,.,,.,,.,,.,,.,,.,,.,,1,0,0,0,0,0,0,,.,,,0,,,,,,,,,,,,,,.,,,"""""""Malian Jihadists Consider Infiltrating Major Cities With Ambulances,"""" Radio Nata, July 7, 2015.""",,,START Primary Collection,0,1,0,1,
