201503290020,2015,3,28,,1,3/31/2015,153,Pakistan,6,South Asia,Balochistan,Patkin,29.078611,65.791944,2,0,,"""03/28/2015: Assailants abducted Saghir Ahmed Badani and Mohammad Azam in Patkin, Balochistan province, Pakistan. Both Badini and Azam, local district chairs, were released unharmed on March 31, 2015. The Baloch Liberation Front (BLF) claimed responsibility and stated that the victims were kidnapped because of their involvement in the elections.""",1,1,1,0,,.,0,1,0,6,Hostage Taking (Kidnapping),,.,,.,2,Government (General),15,Politician or Political Party Movement/Meeting/Rally,Government of Kharan,"""District Chairs: Saghir Ahmed Badani, Mohammad Azam""",153,Pakistan,,.,,.,,,,.,,.,,.,,,,.,Baloch Liberation Front (BLF),,,,,30094,,,,The Baloch Liberation Front (BLF) claimed responsibility for the incident and stated that the district chairs were abducted due to their involvement in elections.,0,,,-99,0,1,2,Call (post-incident),,,.,,,.,,5,Firearms,5,Unknown Gun Type,,.,,.,,.,,.,,.,,.,,0,0,0,0,0,0,0,,.,,,1,2,0,,3,,,0,,,,,,2,Hostage(s) released by perpetrators,2,,"""""""Kharan DC, UC chiefs freed by kidnappers,"""" DAWN Group, April 1, 2015.""","""""""Balochistan Unrest: District council chief, guard   kidnapped,"""" The Express Tribune, March 28, 2015.""","""""""Highlights: Pakistan Balochistan Press 29 March 2015,"""" OSC Summary, March 29, 2015.""",START Primary Collection,0,0,0,0,
201503290043,2015,3,29,,0,,147,Nigeria,11,Sub-Saharan Africa,Bauchi,Alkaleri,10.271304,10.330143,1,0,,"""03/29/2015: Assailants attacked a police station in Alkaleri district, Bauchi state, Nigeria. This was one of four attacks by the same assailants in Bauchi state on the same day. No casualties were reported in the attacks. No group claimed responsibility for the incidents.""",1,1,1,0,,.,1,1,0,2,Armed Assault,7,Facility/Infrastructure Attack,,.,3,Police,22,"""Police Building (headquarters, station, school)""",Nigeria Police Force (NPF),Police Station,147,Nigeria,,.,,.,,,,.,,.,,.,,,,.,Unknown,,,,,-9,,,,,0,,,-99,0,0,,.,,,.,,,.,,5,Firearms,5,Unknown Gun Type,13,Unknown,,.,,.,,.,,.,,.,,0,0,0,0,0,0,1,3,Minor (likely < $1 million),-99,An unknown amount of electronic voting materials were damaged in this attack.,0,,,,,,,,,,,,,,.,,,"""""""Nigeria troops battle Boko Haram near Bauchi: residents, military,"""" Agence France Presse -- English, March 29, 2015.""","""""""Gunmen attack Bauchi voters, police stations,"""" Nigeria Punch, March 29, 2015.""","""""""Gunmen attack Bauchi kill one person, burn police station, set electoral materials ablaze,"""" Nigeria Daily Independent, March 29, 2015.""",START Primary Collection,-9,-9,0,-9,"""201503290040, 201503290041, 201503290042"""
201503290053,2015,3,29,,1,4/28/2015,160,Philippines,5,Southeast Asia,Maguindanao,Shariff Aguak district,6.867549,124.436448,3,0,,"""03/29/2015: Assailants abducted four J Trade Concrete Products and Construction Supply employees in Shariff Aguak district, Maguindanao province, Philippines. The four victims were released unharmed on April 28, 2015. No group claimed responsibility; however, sources suspected that the attack was carried out by the Bangsamoro Islamic Freedom Movement (BIFM), who denied involvement.""",1,1,1,0,,.,0,1,0,6,Hostage Taking (Kidnapping),,.,,.,1,Business,12,Construction,J Trade Concrete Products and Construction Supply,"""Construction Employees: Jason Cababayao, Raulito Suyom Jr., Francis Wong""",160,Philippines,,.,,.,,,,.,,.,,.,,,,.,Bangsamoro Islamic Freedom Movement (BIFM),,,,,40071,,,,"""The specific motive is unknown; however, sources noted that a ransom was demanded in exchange for the victims.""",1,,,-99,0,0,,.,,,.,,,.,,5,Firearms,5,Unknown Gun Type,,.,,.,,.,,.,,.,,.,,0,0,0,0,0,0,0,,.,,,1,4,0,,30,,,1,224719,0,-99,0,,2,Hostage(s) released by perpetrators,4,,"""""""Kidnappers free 4 businessmen from GenSan; ransom paid,"""" MindaNews, May 5, 2015.""","""""""PNP remains clueless on abduction of contractors,"""" Manila Bulletin, April 6, 2015.""","""""""Four kidnapped by gunmen in S. Philippines,"""" Xinhua News Agency, April 4, 2015.""",START Primary Collection,0,0,0,0,
201504020001,2015,4,2,,0,,205,Thailand,5,Southeast Asia,Pattani,Pattani,6.871322,101.248883,1,0,The incident occurred in the Sabarang neighborhood of the city.,"""04/02/2015: An explosive device detonated in front of the Isuzu Motors Ltd. car showroom near the Pattani Vocational Education College in Sabarang neighborhood, Pattani city, Pattani province, Thailand. There were no reported casualties in the blast. This was one of four similar bombings in Muang district on the same day. No group claimed responsibility; however, authorities suspected that the attack was carried out by separatists.""",1,1,1,0,,.,1,1,0,3,Bombing/Explosion,,.,,.,1,Business,7,Retail/Grocery/Bakery,Isuzu Motors Limited,Car Showroom,205,Thailand,,.,,.,,,,.,,.,,.,,,,.,Separatists,,,,,591,,,,"""The specific motive is unknown; however, sources suspected that the attack was carried out in retaliation for the death of four alleged members of an armed group on March 25, 2015 in Thung Yang Daeng district.""",1,,,10,0,0,,.,,,.,,,.,,6,Explosives/Bombs/Dynamite,17,Other Explosive Type,,.,,.,,.,,.,,.,,.,A homemade 10-kilogram explosive device was used in the attack.,0,0,0,0,0,0,1,3,Minor (likely < $1 million),-99,A showroom building was damaged in this attack.,0,,,,,,,,,,,,,,.,,,"""""""Four bombs rock Pattani,"""" Bangkok Post, April 2, 2015.""","""""""Thailand's Muslim shaken by 4 bombs,"""" World Bulletin, April 2, 2015.""","""""""Southern Thailand: Social Media Weekly Highlights 25 March-8 April 2015,"""" OSC Summary, March 25, 2015.""",START Primary Collection,-9,-9,0,-9,"""201504020002, 201504020003, 201504020004"""
201504060004,2015,4,6,,0,,92,India,6,South Asia,Jammu and Kashmir,Tral,33.935438,75.11464,1,0,,"""04/06/2015: Assailants opened fire on Rafiq Ahmad Bhat as he was leaving a bank in Tral town, Jammu and Kashmir state, India. Bhat, a former member of Hizbul Mujahideen (HM), was injured in the assault. No group claimed responsibility; however, sources attributed the attack to separatists.""",1,1,1,0,,.,0,1,0,2,Armed Assault,,.,,.,14,Private Citizens & Property,77,Laborer (General)/Occupation Identified,Not Applicable,Former Hizbul Mujahideen (HM) Member: Rafiq Ahmad Bhat,92,India,,.,,.,,,,.,,.,,.,,,,.,Separatists,,,,,591,,,,,0,,,-99,0,0,,.,,,.,,,.,,5,Firearms,5,Unknown Gun Type,,.,,.,,.,,.,,.,,.,,0,0,0,1,0,0,0,,.,,,0,,,,,,,,,,,,,,.,,,"""""""3 Cops Shot Dead in Shopian, 1 Attacked in Pattan,"""" Kashmir Observer, April 6, 2015.""","""""""3 policmen killed in J&K attack,"""" Deccan Herald, April 6, 2015.""","""""""3 policemen killed in a militant ambush in Sophian,"""" Times of India, April 6, 2015.""",START Primary Collection,-9,-9,0,-9,
201504060055,2015,4,6,,0,,95,Iraq,10,Middle East & North Africa,Al Anbar,Rutbah district,31.392495,41.460836,3,0,The incident occurred near the border with Saudi Arabia,"""04/06/2015: Security forces shot and killed a suicide bomber before he was able to detonate an explosives-laden vehicle near the border with Saudi Arabia outside of Arar, Al Anbar governorate, Iraq. The Islamic State of Iraq and the Levant (ISIL) claimed responsibility for the attack.""",1,1,1,0,,.,0,0,1,3,Bombing/Explosion,,.,,.,20,Unknown,,.,Unknown,Unknown,95,Iraq,,.,,.,,,,.,,.,,.,,,,.,Islamic State of Iraq and the Levant (ISIL),,,,,40151,,,,,0,,,1,0,1,7,"""Posted to website, blog, etc.""",,,.,,,.,,6,Explosives/Bombs/Dynamite,15,Vehicle,,.,,.,,.,,.,,.,,.,,1,0,1,0,0,0,0,,.,,,0,,,,,,,,,,,,,,.,,,"""""""Iraq: ISIL Operational Claims Roundup, 1-10 April 2015,"""" OSC Summary, April 1, 2015.""","""""""IS suicide bomber killed on Iraqi-Saudi border,"""" Albawabh News, April 7, 2015.""",,START Primary Collection,-9,-9,0,-9,
201504070054,2015,4,7,,0,,229,Democratic Republic of the Congo,11,Sub-Saharan Africa,North Kivu,Katwiguru,-1.051389,28.991056,2,0,,"""04/07/2015: Assailants attacked a Congolese National Police (PNC) station in Katwiguru, North Kivu province, Democratic Republic of the Congo. There were no reported casualties; however, at least one police officer was abducted and released a few hours later. No group claimed responsibility; however, sources attributed the attack to the Democratic Front for the Liberation of Rwanda (FDLR).""",1,1,1,0,,.,0,1,0,6,Hostage Taking (Kidnapping),,.,,.,3,Police,22,"""Police Building (headquarters, station, school)""",Congolese National Police (PNC),Police Station,229,Democratic Republic of the Congo,,.,,.,,,,.,,.,,.,,,,.,Democratic Front for the Liberation of Rwanda (FDLR),,,,,20138,,,,,0,,,-99,0,0,,.,,,.,,,.,,13,Unknown,,.,,.,,.,,.,,.,,.,,.,,0,0,0,0,0,0,0,,.,,,1,1,0,2,,,,0,,,,,,2,Hostage(s) released by perpetrators,1,,"""""""Two killed, three wounded as Rwandan rebels attack DRCongo military positions,"""" Goma Radio Okapi, April 9, 2015.""",,,START Primary Collection,1,1,0,1,
201504150091,2015,4,15,"""April 1-30, 2015""",0,,92,India,6,South Asia,Chhattisgarh,Bijapur district,18.872964,80.715734,3,0,,"""04/00/2015: Sometime between April 1, 2015, and April 30, 2015, assailants abducted and killed an Indian Police Service (IPS) officer in Bijapur district, Chhattisgarh state, India. No group claimed responsibility; however, sources attributed the attack to the Communist Party of India - Maoist (CPI-Maoist).""",1,1,1,0,,.,0,1,0,6,Hostage Taking (Kidnapping),,.,,.,3,Police,25,Police Security Forces/Officers,Indian Police Service (IPS),Officer: Bhagirathi Kartam,92,India,,.,,.,,,,.,,.,,.,,,,.,Communist Party of India - Maoist (CPI-Maoist),,,,,20132,,,,,0,,,-99,0,0,,.,,,.,,,.,,13,Unknown,,.,,.,,.,,.,,.,,.,,.,,1,0,0,0,0,0,0,,.,,,1,1,0,-99,,,,0,,,,,,4,Hostage(s) killed (not during rescue attempt),0,,"""""""Local Tribal cops are now target of Maoists in Bastar,"""" DailyMe.Com, October 8, 2015.""",,,START Primary Collection,0,0,0,0,
201504170025,2015,4,17,,0,,113,Libya,10,Middle East & North Africa,Derna,Derna,32.763335,22.640247,1,0,,"""04/17/2015: Assailants briefly detained a civilian in Derna city, Derna district, Libya. The hostage was released after his hand was cut off. No group claimed responsibility; however, a source attributed the attack to the Barqa Province of the Islamic State.""",1,1,1,0,,.,0,1,0,6,Hostage Taking (Kidnapping),,.,,.,14,Private Citizens & Property,67,Unnamed Civilian/Unspecified,Not Applicable,Civilian,113,Libya,,.,,.,,,,.,,.,,.,,,,.,Barqa Province of the Islamic State,,,,,40347,,,,"""The specific motive is unknown; however, sources stated that the Barqa Province of the Islamic State accused the victim of theft.""",0,,,-99,0,0,,.,,,.,,,.,,9,Melee,23,Knife or Other Sharp Object,,.,,.,,.,,.,,.,,.,,0,0,0,1,0,0,0,,.,,,1,1,0,-99,,,,0,,,,,,2,Hostage(s) released by perpetrators,1,,"""""""Libya Daily Digest April 20, 2015,"""" Libya Digest, April 20, 2015.""",,,START Primary Collection,0,0,0,0,
201504200088,2015,4,20,,0,,209,Turkey,10,Middle East & North Africa,Kahramanmaras,Aritis,38.347285,36.819234,1,0,The incident occurred in the Pinarbasi neighborhood of the town.,"""04/20/2015: An assailant stabbed Suca Gennem in Pinarbasi neighborhood, Aritis town, Kahramanmaras province, Turkey. Gennem, a Syrian teacher, was killed in the assault. The Islamic State of Iraq and the Levant (ISIL) claimed responsibility for the attack and stated that Gennem was killed because the group believed he was a spy.""",1,1,1,0,,.,0,1,0,2,Armed Assault,,.,,.,8,Educational Institution,48,Teacher/Professor/Instructor,Unknown,Teacher: Suca Gennem,200,Syria,,.,,.,,,,.,,.,,.,,,,.,Islamic State of Iraq and the Levant (ISIL),,,,,40151,,,,The Islamic State of Iraq and the Levant (ISIL) claimed responsibility for the incident and stated that Suca Gennem was targeted because ISIL believed he was a spy.,0,,,-99,0,1,10,Unknown,,,.,,,.,,9,Melee,23,Knife or Other Sharp Object,,.,,.,,.,,.,,.,,.,,1,0,0,0,0,0,0,,.,,,0,,,,,,,,,,,,,,.,,,"""""""ISIS goes global: Mapping attacks,"""" CNN, December 29, 2015.""","""""""Web monitoring report for 3 December 2015,"""" BBC Monitoring, December 3, 2015.""","""""""Syrian teacher found murdered in southeast Turkey,"""" Today's Zaman Online, April 21, 2015.""",START Primary Collection,-9,-9,1,1,
201504230002,2015,4,23,,0,,160,Philippines,5,Southeast Asia,Maguindanao,Datu Unsay,6.920955,124.456524,1,0,The incident occurred on Mita bridge in Datu Unsay.,"""04/23/2015: An explosive device was discovered and defused at the Mita bridge in Datu Unsay town, Maguindanao province, Philippines. No group claimed responsibility for the incident; however, sources attributed the attempted attack to the Bangsamoro Islamic Freedom Movement (BIFM).""",1,1,1,0,,.,0,0,0,3,Bombing/Explosion,,.,,.,19,Transportation,103,Bridge/Car Tunnel,Unknown,Mita Bridge,160,Philippines,,.,,.,,,,.,,.,,.,,,,.,Bangsamoro Islamic Freedom Movement (BIFM),,,,,40071,,,,,0,,,-99,0,0,,.,,,.,,,.,,6,Explosives/Bombs/Dynamite,17,Other Explosive Type,,.,,.,,.,,.,,.,,.,A hand grenade attached to a rocket-propelled grenade (RPG) was used in the attack.,0,0,0,0,0,0,0,,.,,,0,,,,,,,,,,,,,,.,,,"""""""Overshadowed leader tagged in BIFF sabotage plot, bombings,"""" Philippine Star, April 28, 2015.""","""""""Army foils BIFF bombing attempt to destroy Maguindanao bridge,"""" Philippines News Agency, April 24, 2015.""","""""""Army foils BIFF attempt  to bomb Maguindanao bridge,"""" Manila Bulletin, April 24, 2015.""",START Primary Collection,0,0,0,0,
201504250007,2015,4,25,,0,,95,Iraq,10,Middle East & North Africa,Al Anbar,Trebiel,32.740792,39.009361,1,0,,"""04/25/2015: A suicide bomber detonated at the Trebiel border crossing in Al Anbar governorate, Iraq. This was one of two coordinated attacks at the same location on the same day. This attack targeted Dari al-Ursan, a regional leader, as he came to inspect the crossing following an earlier bombing. Ursan and four other people were injured in the blast. The Islamic State of Iraq and the Levant (ISIL) claimed responsibility for the incidents.""",1,1,1,0,,.,1,0,1,1,Assassination,,.,,.,2,Government (General),18,"""Government Personnel (excluding police, military)""",Government of Al Walid,Leader: Dari al-Ursan,95,Iraq,,.,,.,,,,.,,.,,.,,,,.,Islamic State of Iraq and the Levant (ISIL),,,,,40151,,,,,0,,,1,0,1,7,"""Posted to website, blog, etc.""",,,.,,,.,,6,Explosives/Bombs/Dynamite,13,Suicide (carried bodily by human being),,.,,.,,.,,.,,.,,.,,1,0,1,5,0,0,0,,.,,,0,,,,,,,,,,,,,,.,,,"""""""Islamic State Seizes Dam, Kills Iraqi General, 127 Soldiers,"""" Bloomberg, April 25, 2015.""","""""""Iraq: Roundup of Security Incidents 21-27 April 2015,"""" OSC Summary, April 21, 2015.""","""""""Iraq: ISIL Operational Claims Roundup, 21-30 April 2015,"""" OSC Summary, April 21, 2015.""",START Primary Collection,-9,-9,0,-9,201504250004
201504260108,2015,4,26,,0,,78,Greece,8,Western Europe,Attica,Athens,37.986472,23.736655,1,0,,"""04/26/2015: Assailants attacked Yanis Varoufakis and his spouse in Exarchia district, Athens, Attica region, Greece. Varoufakis, the Greek Finance Minister, and his spouse were unharmed in the attack. No group claimed responsibility for the incident; however, Varoufakis attributed the attack to anarchists.""",1,1,1,0,,.,0,0,0,8,Unarmed Assault,,.,,.,2,Government (General),18,"""Government Personnel (excluding police, military)""",Greek Ministry of Finance,Minister: Yanis Varoufakis,78,Greece,,.,,.,,,,.,,.,,.,,,,.,Anarchists,,,,,648,,,,,0,,,-99,0,0,,.,,,.,,,.,,12,Other,,.,,.,,.,,.,,.,,.,,.,Thrown glass objects were used in the attack.,0,0,0,0,0,0,0,,.,,,0,,,,,,,,,,,,,,.,,,"""""""Varoufakis attacked by anarchists while dining in Athens,"""" EKathimerini.com, April 29, 2015.""",,,START Primary Collection,-9,-9,0,-9,
201504270015,2015,4,27,2015-04-27 00:00:00,0,,4,Afghanistan,6,South Asia,Badakhshan,Baharak district,37.005424,70.879786,3,0,,"""04/27/2015: Assailants fired a rocket at Ahmad Zia Masood in Baharak district, Badakhshan province, Afghanistan. Masood, a presidential adviser on reforms and good governance, survived the attack. The Taliban claimed responsibility for the incident""",1,1,1,0,,.,0,0,0,1,Assassination,,.,,.,2,Government (General),18,"""Government Personnel (excluding police, military)""",Government of Afghanistan,Presidential Adviser: Ahmad Zia Masood,4,Afghanistan,,.,,.,,,,.,,.,,.,,,,.,Taliban,,,,,652,,,,,0,,,-99,0,1,7,"""Posted to website, blog, etc.""",,,.,,,.,,6,Explosives/Bombs/Dynamite,11,"""Projectile (rockets, mortars, RPGs, etc.)""",,.,,.,,.,,.,,.,,.,A rocket was used in the attack.,0,0,0,0,0,0,-9,,.,,It is unknown if any property was damaged in this attack.,0,,,,,,,,,,,,,,.,,,"""""""SECTION:   GENERAL NEWS,"""" Thai News Service, April 30, 2015.""","""""""Highlights: Pakistan Pashto Press 28 April, 2015,"""" OSC Summary, April 28, 2015.""","""""""Puppet delegation headed by Ahmad Zia Masoud attacked,"""" Voice of Jihad website, April 27, 2015.""",START Primary Collection,0,0,0,0,
201504290038,2015,4,29,,0,,92,India,6,South Asia,Chhattisgarh,Sukma,18.390681,81.659305,1,0,The incident occurred 15 kilometers away in Chingavaram village.,"""04/29/2015: Assailants set fire to a bus near Chingavaram village, Sukma, Chhattisgarh state, India. There were no reported casualties. No group claimed responsibility for the incident; however, authorities attributed the attack to Maoists.""",1,1,1,0,,.,0,1,0,7,Facility/Infrastructure Attack,,.,,.,19,Transportation,99,Bus (excluding tourists),Unknown,Passenger Bus,92,India,,.,,.,,,,.,,.,,.,,,,.,Maoists,,,,,1430,,,,,0,,,-99,0,0,,.,,,.,,,.,,8,Incendiary,18,Arson/Fire,,.,,.,,.,,.,,.,,.,,0,0,0,0,0,0,1,3,Minor (likely < $1 million),-99,A bus was damaged in this attack.,0,,,,,,,,,,,,,,.,,,"""""""Maoists torch bus in Chingavaram village,"""" New Delhi Pioneer, April 29, 2015.""",,,START Primary Collection,-9,-9,0,-9,
201504300049,2015,4,30,,0,,173,Saudi Arabia,10,Middle East & North Africa,Najran,Unknown,18.520277,45.69972,4,0,,"""04/30/2015: Assailants crossed the border from Yemen and attacked an unknown number of observation and control points in Najran region, Saudi Arabia. Three Saudi soldiers and at least 24 assailants were killed in the attack. No group claimed responsibility for the incident; however, sources attributed the attack to Huthis.""",1,1,1,1,5,State Actors,0,1,0,2,Armed Assault,,.,,.,3,Police,24,Police Checkpoint,Saudi Border Guard,Border Checkpoints,173,Saudi Arabia,,.,,.,,,,.,,.,,.,,,,.,Huthi Extremists,,,,,20198,,,,,0,,,-99,0,0,,.,,,.,,,.,,5,Firearms,5,Unknown Gun Type,,.,,.,,.,,.,,.,,.,,27,0,24,,0,,0,,.,,,0,,,,,,,,,,,,,,.,,"""There is doubt that this incident meets terrorism-related criteria. It is unclear who has sovereign authority in Yemen and the legitimacy of the Huthis as a governing body is contested. Casualty numbers for this incident conflict across sources. Following GTD protocol, the majority reliable estimates are reported here.""","""""""Houthi rebels attack 'Saudi border',"""" BBC, April 30, 2015.""","""""""Saudi repels Houthi attack on border,"""" The Gulf Today, May 2, 2015.""","""""""Yemeni conflict spills into Saudi Arabia,"""" UPI, May 1, 2015.""",START Primary Collection,1,1,0,1,
201504300061,2015,5,1,,0,,4,Afghanistan,6,South Asia,Khost,Babrak Tana,33.467621,70.090885,2,0,,"""05/01/2015: Assailants attacked an Afghan Border Police (ABP) checkpoint in Babrak Tana area, Ali Shir district, Khost province, Afghanistan. This was one of two checkpoints targeted in Khost on the same date. Twenty-five assailants and two police officers were killed and 21 assailants and five officers wounded across both attacks. The Taliban claimed responsibility for the incident.""",1,1,1,0,,.,1,1,0,2,Armed Assault,,.,,.,3,Police,24,Police Checkpoint,Afghan Border Police (ABP),Checkpoint,4,Afghanistan,,.,,.,,,,.,,.,,.,,,,.,Taliban,,,,,652,,,,,0,,,200,0,1,8,Personal claim,,,.,,,.,,5,Firearms,5,Unknown Gun Type,,.,,.,,.,,.,,.,,.,,14,0,13,13,0,11,0,,.,,,0,,,,,,,,,,,,,,.,,"""Casualty numbers for this incident conflict across sources. Following GTD protocol, the majority reliable estimates are reported here. Casualty numbers for this incident represent a division of a cumulative total of killed and wounded across incidents 201504300061 and 201505010062.""","""""""Afghan violence claims 35 lives, wound 45 within day,"""" Philippines News Agency, May 1, 2015.""","""""""25 rebels killed, 21 injured in Khost firefight,"""" Afghanistan Times, May 1, 2015.""","""""""Program Summary: Kabul Noor TV Dari 1300 GMT 01 May 15,"""" Noor TV, May 1, 2015.""",START Primary Collection,0,0,0,0,201505010062
201505040004,2015,5,4,,1,8/19/2015,160,Philippines,5,Southeast Asia,Zamboanga del Norte,Aliguay,8.745833,123.222222,1,0,,"""05/04/2015: Assailants abducted a village chairperson and two Coast Guard members from Aliguay village, Dapitan City, Zamboanga del Norte province, Philippines. The chairperson was beheaded on August 11, 2015, while the other two hostages escaped on August 19, 2015. The Abu Sayyaf Group (ASG) claimed responsibility for the incident.""",1,1,1,0,,.,0,1,0,1,Assassination,6,Hostage Taking (Kidnapping),,.,2,Government (General),15,Politician or Political Party Movement/Meeting/Rally,Government of Aliguay,Village Chair: Rudy Baligao,160,Philippines,3,Police,25,Police Security Forces/Officers,Philippine Coast Guard (PCG),"""Officers: Seaman First Class Rodlyn Pagaling, Seaman Second Class Gringo Villaruz""",160,Philippines,,.,,.,,,,.,Abu Sayyaf Group (ASG),,,,,276,,,,,0,,,6,0,1,6,Video,,,.,,,.,,5,Firearms,5,Unknown Gun Type,9,Melee,23,Knife or Other Sharp Object,,.,,.,,.,,.,,1,0,0,0,0,0,0,,.,,,1,3,0,,108,,,1,6862963.66,0,0,0,"""Other sources noted that the assailants demanded a ransom of $68,629.64. The ransom was later decreased to $2,156,428. It was then decreased to $215,642. Finally, it was decreased to $64,693.""",6,Combination,2,,"""""""Philippine coastguard Rod Allain Pagaling (C), who escaped from his Abu Sayyaf captors earlier this week, carries his daughter Allian with wife Judith (L) as he is reunited with his family in Manila on August 21, 2015,"""" AFP, August 21, 2015.""","""""""2 coast guard men, village chief, abducted in Philippines,"""" Associated Press International, May 4, 2015.""","""""""2 hostages escape as military battles Abus,"""" Philippine Star, August 20, 2015.""",START Primary Collection,0,0,0,0,
201505060086,2015,5,6,,0,,603,United Kingdom,8,Western Europe,Northern Ireland,Londonderry,55.039475,-7.314422,1,0,The incident occurred in Oakbridge Park neighborhood,"""05/06/2015: Assailants set fire to the vehicle of Sandra Duffy, a Sinn Fein councillor, in Oakbridge Park, Londonderry city, Northern Ireland, United Kingdom. There were no reported casualties in the attack. This was one of two related attacks in Londonderry on the same date. No group claimed responsibility; however, sources attributed the incident to dissident republicans.""",1,1,1,0,,.,1,1,0,7,Facility/Infrastructure Attack,,.,,.,2,Government (General),15,Politician or Political Party Movement/Meeting/Rally,Government of Northern Ireland,Car of Councillor: Sandra Duffy,233,Northern Ireland,,.,,.,,,,.,,.,,.,,,,.,Dissident Republicans,,,,,40150,,,,,0,,,2,2,0,,.,,,.,,,.,,8,Incendiary,18,Arson/Fire,,.,,.,,.,,.,,.,,.,,0,0,0,0,0,0,1,3,Minor (likely < $1 million),-99,A vehicle was damaged in this attack.,0,,,,,,,,,,,,,,.,,,"""""""'Bomb warning' at Gerry Adams' home in Belfast,"""" UTV, May 6, 2015.""",,,START Primary Collection,0,0,1,1,201505060087
201505110056,2015,5,11,,0,,92,India,6,South Asia,Jammu and Kashmir,Sangam,33.827506,75.072066,1,1,The incident occurred along the Jammu-Srinagar National Highway,"""05/11/2015: Four assailants opened fire on Central Reserve Police Force (CRPF) personnel on Jammu-Srinagar National Highway near Sangam area, Jammu and Kashmir state, India. Two police officers were killed in the attack. Hizbul Mujahideen (HM) claimed responsibility for the incident.""",1,1,1,0,,.,0,1,0,2,Armed Assault,,.,,.,3,Police,25,Police Security Forces/Officers,Central Reserve Police Force (CRPF),"""Officers: Omkar Singh, Tilak Raj""",92,India,,.,,.,,,,.,,.,,.,,,,.,Hizbul Mujahideen (HM),,,,,1380,,,,,0,,,3,0,1,8,Personal claim,,,.,,,.,,5,Firearms,5,Unknown Gun Type,,.,,.,,.,,.,,.,,.,,2,0,0,0,0,0,0,,.,,,0,,,,,,,,,,,,,,.,,,"""""""Two CRPF Personnel Killed in Militant Attack in J&K,"""" Outlook India, May 11, 2015.""","""""""Militants kill 2 Indian paramilitary troopers in Indian-controlled Kashmir,"""" Xinhua News Agency, May 11, 2015.""","""""""Two CRPF men killed in militant attack,"""" The Hindu, May 11, 2015.""",START Primary Collection,1,1,0,1,
